{
  "$schema": "http://json-schema.org/draft-07/schema#",
  "title": "Sections",
  "type": "array",
  "minItems": 1,
  "items": {
    "type": "object",
    "additionalProperties": false,
    "required": ["id", "name", "icon", "commands"],
    "properties": {
      "id": { "type": "string", "pattern": "^[a-z0-9-]+$" },
      "name": { "type": "string", "minLength": 1 },
      "icon": { "type": "string", "minLength": 1 },
      "type": { "type": "string", "enum": ["scripts"] },
      "dir": { "type": "string", "pattern": "^[a-z0-9-]+$" },
      "commands": {
        "type": "array",
        "items": { "type": "string", "pattern": "^[a-z0-9.-]+$" }
      }
    }
  }
}
