[
  {
    "id": "archivos",
    "name": "Archivos y directorios",
    "icon": "folder",
    "commands": [
      "ls",
      "cd",
      "pwd",
      "cp",
      "mv",
      "rm",
      "mkdir",
      "rmdir",
      "touch",
      "ln",
      "tree",
      "file",
      "stat",
      "basename",
      "dirname",
      "realpath",
      "readlink",
      "rename"
    ]
  },
  {
    "id": "texto",
    "name": "Procesamiento de texto",
    "icon": "text",
    "commands": [
      "cat",
      "tac",
      "head",
      "tail",
      "less",
      "more",
      "grep",
      "sed",
      "awk",
      "cut",
      "sort",
      "uniq",
      "tr",
      "wc",
      "diff",
      "comm",
      "paste",
      "tee",
      "xargs",
      "printf",
      "echo",
      "fold",
      "column",
      "rev",
      "strings"
    ]
  },
  {
    "id": "permisos",
    "name": "Permisos y propietarios",
    "icon": "security",
    "commands": [
      "chmod",
      "chown",
      "chgrp",
      "umask",
      "getfacl",
      "setfacl",
      "chattr",
      "lsattr",
      "su",
      "sudo",
      "visudo"
    ]
  },
  {
    "id": "usuarios",
    "name": "Usuarios y grupos",
    "icon": "user",
    "commands": [
      "useradd",
      "adduser",
      "usermod",
      "userdel",
      "groupadd",
      "groupmod",
      "groupdel",
      "passwd",
      "chage",
      "id",
      "groups",
      "who",
      "w",
      "last",
      "lastlog",
      "whoami",
      "gpasswd"
    ]
  },
  {
    "id": "procesos",
    "name": "Procesos y recursos",
    "icon": "cpu",
    "commands": [
      "ps",
      "top",
      "htop",
      "kill",
      "killall",
      "pkill",
      "pgrep",
      "nice",
      "renice",
      "jobs",
      "fg",
      "bg",
      "nohup",
      "watch",
      "time",
      "timeout",
      "lsof",
      "strace",
      "ltrace",
      "at",
      "crontab",
      "screen",
      "tmux",
      "pstree",
      "pidof"
    ]
  },
  {
    "id": "sistema",
    "name": "Sistema e información",
    "icon": "server",
    "commands": [
      "uname",
      "hostname",
      "uptime",
      "free",
      "vmstat",
      "iostat",
      "sar",
      "date",
      "cal",
      "timedatectl",
      "locale",
      "localectl",
      "dmesg",
      "sysctl",
      "lsmod",
      "modprobe",
      "insmod",
      "rmmod",
      "modinfo",
      "lscpu",
      "lspci",
      "lsusb",
      "lshw",
      "dmidecode",
      "nproc",
      "ulimit",
      "reboot",
      "shutdown",
      "poweroff"
    ]
  },
  {
    "id": "disco",
    "name": "Discos y almacenamiento",
    "icon": "disk",
    "commands": [
      "df",
      "du",
      "mount",
      "umount",
      "lsblk",
      "blkid",
      "fdisk",
      "parted",
      "mkfs",
      "mkswap",
      "swapon",
      "swapoff",
      "fsck",
      "e2fsck",
      "tune2fs",
      "findmnt",
      "dd",
      "sync",
      "pvcreate",
      "vgcreate",
      "lvcreate",
      "mdadm"
    ]
  },
  {
    "id": "compresion",
    "name": "Compresión y empaquetado",
    "icon": "backup",
    "commands": [
      "tar",
      "gzip",
      "gunzip",
      "bzip2",
      "xz",
      "zstd",
      "zip",
      "unzip",
      "7z",
      "zcat",
      "zless",
      "unrar"
    ]
  },
  {
    "id": "redes",
    "name": "Redes",
    "icon": "network",
    "commands": [
      "ip",
      "ifconfig",
      "ping",
      "traceroute",
      "mtr",
      "ss",
      "netstat",
      "dig",
      "nslookup",
      "host",
      "whois",
      "curl",
      "wget",
      "nc",
      "telnet",
      "ssh",
      "scp",
      "sftp",
      "rsync",
      "ssh-keygen",
      "ssh-copy-id",
      "arp",
      "ethtool",
      "nmcli",
      "nmtui",
      "socat",
      "openssl",
      "firewall-cmd",
      "ufw",
      "iptables",
      "nft",
      "tcpdump"
    ]
  },
  {
    "id": "servicios",
    "name": "Servicios y systemd",
    "icon": "service",
    "commands": [
      "systemctl",
      "service",
      "journalctl",
      "systemd-analyze",
      "systemd-run",
      "loginctl",
      "chkconfig",
      "update-rc.d"
    ]
  },
  {
    "id": "paquetes",
    "name": "Gestión de paquetes",
    "icon": "package",
    "commands": [
      "apt",
      "apt-get",
      "apt-cache",
      "dpkg",
      "add-apt-repository",
      "dnf",
      "yum",
      "rpm",
      "pacman",
      "yay",
      "zypper",
      "apk",
      "emerge",
      "xbps-install",
      "nix-env",
      "flatpak",
      "snap",
      "pip"
    ]
  },
  {
    "id": "shell",
    "name": "Shell y scripting",
    "icon": "shell",
    "commands": [
      "bash",
      "sh",
      "source",
      "export",
      "env",
      "read",
      "test",
      "eval",
      "exec",
      "trap",
      "set",
      "unset",
      "alias",
      "unalias",
      "history",
      "seq",
      "yes",
      "getopts"
    ]
  },
  {
    "id": "editores",
    "name": "Editores de texto",
    "icon": "tools",
    "commands": [
      "nano",
      "vim",
      "vi",
      "emacs",
      "micro"
    ]
  },
  {
    "id": "recon",
    "name": "Reconocimiento y escaneo",
    "icon": "radar",
    "commands": [
      "nmap",
      "masscan",
      "netdiscover",
      "arp-scan",
      "fping",
      "hping3",
      "dnsenum",
      "dnsrecon",
      "fierce",
      "theharvester",
      "sublist3r",
      "amass",
      "subfinder",
      "assetfinder",
      "dnsx",
      "httpx",
      "gau",
      "waybackurls",
      "whatweb",
      "wafw00f",
      "nikto",
      "dirb",
      "gobuster",
      "ffuf",
      "wfuzz",
      "dirsearch",
      "feroxbuster",
      "wpscan",
      "enum4linux",
      "smbclient",
      "smbmap",
      "ldapsearch",
      "snmpwalk",
      "onesixtyone",
      "showmount",
      "nbtscan",
      "eyewitness"
    ]
  },
  {
    "id": "passwords",
    "name": "Fuerza bruta y cracking",
    "icon": "key",
    "commands": [
      "john",
      "hashcat",
      "hydra",
      "medusa",
      "ncrack",
      "patator",
      "crunch",
      "cewl",
      "cupp",
      "hash-identifier",
      "hashid",
      "unshadow",
      "ophcrack",
      "fcrackzip",
      "pdfcrack",
      "rarcrack",
      "zip2john",
      "ssh2john",
      "keepass2john",
      "findmyhash",
      "samdump2"
    ]
  },
  {
    "id": "explotacion",
    "name": "Explotación y post-explotación",
    "icon": "bug",
    "commands": [
      "msfconsole",
      "msfvenom",
      "searchsploit",
      "sqlmap",
      "commix",
      "xsser",
      "beef-xss",
      "setoolkit",
      "veil",
      "routersploit",
      "responder",
      "crackmapexec",
      "impacket",
      "psexec",
      "wmiexec",
      "evil-winrm",
      "bloodhound",
      "mimikatz",
      "meterpreter",
      "chisel",
      "ligolo-ng",
      "nishang",
      "empire",
      "sliver"
    ]
  },
  {
    "id": "forense",
    "name": "Análisis forense",
    "icon": "fingerprint",
    "commands": [
      "volatility",
      "autopsy",
      "sleuthkit",
      "foremost",
      "scalpel",
      "binwalk",
      "exiftool",
      "steghide",
      "zsteg",
      "bulk-extractor",
      "photorec",
      "testdisk",
      "dc3dd",
      "ewfacquire",
      "radare2",
      "ghidra",
      "objdump",
      "readelf",
      "nm",
      "hexdump",
      "xxd"
    ]
  },
  {
    "id": "scripts",
    "name": "Scripts",
    "icon": "script",
    "type": "scripts",
    "dir": "scripts",
    "commands": [
      "update-debian",
      "update-fedora",
      "update-arch"
    ]
  }
]
